{
  "schema_version": "1.1.0",
  "id": "UNI_RUDN_DORM_LEASE",
  "university_id": "UNIV_RUDN",
  "kind": "university",
  "version": 1,
  "status": "draft",
  "title": "Заключить договор проживания РУДН",
  "summary": "Со специалистом общежития выберите комнату, заключите договор и получите счёт.",
  "obligation_scope": "university_internal",
  "applicability": {
    "op": "all",
    "args": [
      {
        "op": "eq",
        "fact": "foreign_person",
        "value": true
      },
      {
        "op": "eq",
        "fact": "rudn_campus",
        "value": "main"
      },
      {
        "op": "eq",
        "fact": "rudn_own_dormitory",
        "value": true
      }
    ]
  },
  "trigger": {
    "kind": "event",
    "event_type": "rudn_dorm_direction_received",
    "occurrence": "each",
    "where": {
      "op": "always"
    }
  },
  "deadline": {
    "kind": "unknown",
    "unresolved_ids": [
      "UNR_RUDN_DORM_LEASE"
    ]
  },
  "instructions": [
    "Со специалистом общежития выберите комнату, заключите договор и получите счёт."
  ],
  "documents": [],
  "destination": {
    "kind": "hybrid",
    "name": "МФЦ РУДН",
    "address": "Москва, ул. Миклухо-Маклая, 6, цокольный этаж",
    "url": "https://lk.rudn.ru/",
    "contacts": [
      {
        "kind": "email",
        "value": "mfc@rudn.ru",
        "label": "МФЦ РУДН"
      }
    ],
    "appointment_required": "yes"
  },
  "result": {
    "title": "Сведения переданы / локальное действие выполнено",
    "completion_mode": "user_confirmation"
  },
  "warnings": [
    {
      "id": "WARN_UNI_RUDN_DORM_LEASE",
      "severity": "blocking",
      "message": "Локальная инструкция ограничена указанным контекстом; нерешённые детали перечислены отдельно.",
      "unresolved_ids": [
        "UNR_RUDN_DORM_LEASE"
      ]
    }
  ],
  "depends_on": [
    "UNI_RUDN_DORM_DIRECTION"
  ],
  "effective_period": {},
  "evidence": [
    {
      "source_id": "SRC_RUDN_HOUSING",
      "locator": "Порядок предоставления места",
      "supports": "Перечисленные локальные действия и реквизиты; федеральный нормативный срок этим источником не устанавливается.",
      "fields": [
        "/instructions",
        "/destination"
      ],
      "checked_on": "2026-09-26",
      "support_level": "partial"
    }
  ],
  "unresolved_ids": [
    "UNR_RUDN_DORM_LEASE"
  ],
  "review": {
    "reviewed_at": "2026-09-26T11:47:31.010529Z",
    "reviewer": "Новое последовательное исследование официальных ресурсов",
    "next_review_on": "2026-10-26"
  }
}
