{
  "schema_version": "1.1.0",
  "id": "UNI_TSU_TRAVEL_NOTIFY",
  "university_id": "UNIV_TSU",
  "kind": "university",
  "version": 1,
  "status": "draft",
  "title": "Уведомить ТГУ о поездке или временном выбытии",
  "summary": "Сообщите о поездке центру сопровождения и координатору; проживающие в общежитии также уведомляют паспортиста.",
  "obligation_scope": "university_internal",
  "applicability": {
    "op": "all",
    "args": [
      {
        "op": "eq",
        "fact": "foreign_person",
        "value": true
      },
      {
        "op": "eq",
        "fact": "tsu_campus",
        "value": "main"
      },
      {
        "op": "always"
      }
    ]
  },
  "trigger": {
    "kind": "event",
    "event_type": "departure_planned",
    "occurrence": "each",
    "where": {
      "op": "always"
    }
  },
  "deadline": {
    "kind": "unknown",
    "unresolved_ids": [
      "UNR_TSU_TRAVEL_NOTIFY"
    ]
  },
  "instructions": [
    "Сообщите о поездке центру сопровождения и координатору; проживающие в общежитии также уведомляют паспортиста."
  ],
  "documents": [],
  "destination": {
    "kind": "online",
    "name": "Центр сопровождения ТГУ",
    "url": "https://tsu.ru/university/structure/upravl/inter_upr.php?nv=on",
    "contacts": [
      {
        "kind": "email",
        "value": "studentcenter@mail.tsu.ru",
        "label": "Сопровождение"
      }
    ],
    "appointment_required": "unknown"
  },
  "result": {
    "title": "Сведения переданы / локальное действие выполнено",
    "completion_mode": "user_confirmation"
  },
  "warnings": [
    {
      "id": "WARN_UNI_TSU_TRAVEL_NOTIFY",
      "severity": "blocking",
      "message": "Локальная инструкция ограничена указанным контекстом; нерешённые детали перечислены отдельно.",
      "unresolved_ids": [
        "UNR_TSU_TRAVEL_NOTIFY"
      ]
    }
  ],
  "depends_on": [],
  "effective_period": {},
  "evidence": [
    {
      "source_id": "SRC_TSU_VISA",
      "locator": "I am going to leave",
      "supports": "Перечисленные локальные действия и реквизиты; федеральный нормативный срок этим источником не устанавливается.",
      "fields": [
        "/instructions",
        "/destination"
      ],
      "checked_on": "2026-09-26",
      "support_level": "partial"
    },
    {
      "source_id": "SRC_TSU_CONTACT",
      "locator": "I am going to leave",
      "supports": "Перечисленные локальные действия и реквизиты; федеральный нормативный срок этим источником не устанавливается.",
      "fields": [
        "/instructions",
        "/destination"
      ],
      "checked_on": "2026-09-26",
      "support_level": "partial"
    },
    {
      "source_id": "SRC_TSU_VISA",
      "locator": "Локальное указание срока в источнике карточки",
      "supports": "Опубликованный внутренний срок; неполное исчисление остаётся unresolved.",
      "fields": [
        "/deadline",
        "/reported_deadline_text"
      ],
      "checked_on": "2026-09-26",
      "support_level": "partial"
    }
  ],
  "unresolved_ids": [
    "UNR_TSU_TRAVEL_NOTIFY"
  ],
  "review": {
    "reviewed_at": "2026-09-26T11:37:54.661491Z",
    "reviewer": "Новое последовательное исследование официальных ресурсов",
    "next_review_on": "2026-10-26"
  },
  "reported_deadline_text": "В течение трёх рабочих дней"
}
