{
  "schema_version": "1.1.0",
  "id": "UNI_KFU_CONTROL_SHEET",
  "university_id": "UNIV_KFU",
  "kind": "university",
  "version": 1,
  "status": "draft",
  "title": "Получить лист контроля КФУ",
  "summary": "Получите лист контроля у ответственного сотрудника института.",
  "obligation_scope": "university_internal",
  "applicability": {
    "op": "all",
    "args": [
      {
        "op": "eq",
        "fact": "foreign_person",
        "value": true
      },
      {
        "op": "eq",
        "fact": "kfu_campus",
        "value": "main"
      },
      {
        "op": "eq",
        "fact": "kfu_continuing_years_two_five",
        "value": true
      }
    ]
  },
  "trigger": {
    "kind": "event",
    "event_type": "kfu_arrival_local",
    "occurrence": "each",
    "where": {
      "op": "always"
    }
  },
  "deadline": {
    "kind": "unknown",
    "unresolved_ids": [
      "UNR_KFU_CONTROL_SHEET"
    ]
  },
  "instructions": [
    "Получите лист контроля у ответственного сотрудника института."
  ],
  "documents": [],
  "destination": {
    "kind": "hybrid",
    "name": "Паспортно-визовый отдел ДВС КФУ",
    "address": "Казань, ул. Гвардейская, 9, зал А",
    "url": "https://kpfu.ru/international/migracionnoe-soprovozhdenie-inostrannyh-grazhdan/",
    "contacts": [
      {
        "kind": "phone",
        "value": "+7 (843) 206-52-89 доб. 8135",
        "label": "Паспортно-визовый отдел"
      }
    ],
    "appointment_required": "yes",
    "notes": "Приём по электронной очереди и талонам; прямой адрес записи не подтверждён."
  },
  "result": {
    "title": "Сведения переданы / локальное действие выполнено",
    "completion_mode": "user_confirmation"
  },
  "warnings": [
    {
      "id": "WARN_UNI_KFU_CONTROL_SHEET",
      "severity": "blocking",
      "message": "Локальная инструкция ограничена указанным контекстом; нерешённые детали перечислены отдельно.",
      "unresolved_ids": [
        "UNR_KFU_CONTROL_SHEET"
      ]
    }
  ],
  "depends_on": [],
  "effective_period": {},
  "evidence": [
    {
      "source_id": "SRC_KFU_HOUSING",
      "locator": "Заселение иностранных обучающихся",
      "supports": "Перечисленные локальные действия и реквизиты; федеральный нормативный срок этим источником не устанавливается.",
      "fields": [
        "/instructions",
        "/destination"
      ],
      "checked_on": "2026-09-26",
      "support_level": "partial"
    }
  ],
  "unresolved_ids": [
    "UNR_KFU_CONTROL_SHEET"
  ],
  "review": {
    "reviewed_at": "2026-09-26T11:43:51.618487Z",
    "reviewer": "Новое последовательное исследование официальных ресурсов",
    "next_review_on": "2026-10-26"
  }
}
