{
  "schema_version": "1.1.0",
  "id": "UNI_SPBU_ARRIVAL_NOTIFY",
  "university_id": "UNIV_SPBU",
  "kind": "university",
  "version": 1,
  "status": "draft",
  "title": "Сообщить СПбГУ о въезде",
  "summary": "Отправьте уведомление о прибытии в УМиРР и свой учебный отдел.",
  "obligation_scope": "university_internal",
  "applicability": {
    "op": "all",
    "args": [
      {
        "op": "eq",
        "fact": "foreign_person",
        "value": true
      },
      {
        "op": "eq",
        "fact": "spbu_campus",
        "value": "main"
      },
      {
        "op": "always"
      }
    ]
  },
  "trigger": {
    "kind": "event",
    "event_type": "border_entry",
    "occurrence": "each",
    "where": {
      "op": "always"
    }
  },
  "deadline": {
    "kind": "unknown",
    "unresolved_ids": [
      "UNR_SPBU_ARRIVAL_NOTIFY"
    ]
  },
  "instructions": [
    "Отправьте уведомление о прибытии в УМиРР и свой учебный отдел."
  ],
  "documents": [],
  "destination": {
    "kind": "online",
    "name": "Управление по миграционной и регистрационной работе СПбГУ",
    "url": "https://guide.spbu.ru/foreigner",
    "contacts": [
      {
        "kind": "email",
        "value": "pvo@spbu.ru",
        "label": "УМиРР"
      }
    ],
    "appointment_required": "unknown"
  },
  "result": {
    "title": "Сведения переданы / локальное действие выполнено",
    "completion_mode": "user_confirmation"
  },
  "warnings": [
    {
      "id": "WARN_UNI_SPBU_ARRIVAL_NOTIFY",
      "severity": "blocking",
      "message": "Локальная инструкция ограничена указанным контекстом; нерешённые детали перечислены отдельно.",
      "unresolved_ids": [
        "UNR_SPBU_ARRIVAL_NOTIFY"
      ]
    }
  ],
  "depends_on": [],
  "effective_period": {},
  "evidence": [
    {
      "source_id": "SRC_SPBU_GUIDE",
      "locator": "Иностранцам: порядок передачи сведений",
      "supports": "Перечисленные локальные действия и реквизиты; федеральный нормативный срок этим источником не устанавливается.",
      "fields": [
        "/instructions",
        "/destination"
      ],
      "checked_on": "2026-09-26",
      "support_level": "partial"
    },
    {
      "source_id": "SRC_SPBU_GUIDE",
      "locator": "Локальное указание срока в источнике карточки",
      "supports": "Опубликованный внутренний срок; неполное исчисление остаётся unresolved.",
      "fields": [
        "/deadline",
        "/reported_deadline_text"
      ],
      "checked_on": "2026-09-26",
      "support_level": "partial"
    }
  ],
  "unresolved_ids": [
    "UNR_SPBU_ARRIVAL_NOTIFY"
  ],
  "review": {
    "reviewed_at": "2026-09-26T11:34:43.776826Z",
    "reviewer": "Новое последовательное исследование официальных ресурсов",
    "next_review_on": "2026-10-26"
  },
  "reported_deadline_text": "В течение двух дней после пересечения границы"
}
