{
  "schema_version": "1.1.0",
  "id": "UNI_MIPT_POLICY_COPY",
  "university_id": "UNIV_MIPT",
  "kind": "university",
  "version": 1,
  "status": "draft",
  "title": "Передать полис подготовительному отделению МФТИ",
  "summary": "Отправьте фото или скан полученного полиса на почту подготовительного отделения.",
  "obligation_scope": "university_internal",
  "applicability": {
    "op": "all",
    "args": [
      {
        "op": "eq",
        "fact": "foreign_person",
        "value": true
      },
      {
        "op": "eq",
        "fact": "mipt_campus",
        "value": "main"
      },
      {
        "op": "eq",
        "fact": "mipt_preparatory",
        "value": true
      }
    ]
  },
  "trigger": {
    "kind": "event",
    "event_type": "mipt_policy_received",
    "occurrence": "each",
    "where": {
      "op": "always"
    }
  },
  "deadline": {
    "kind": "unknown",
    "unresolved_ids": [
      "UNR_MIPT_POLICY_COPY"
    ]
  },
  "instructions": [
    "Отправьте фото или скан полученного полиса на почту подготовительного отделения."
  ],
  "documents": [],
  "destination": {
    "kind": "online",
    "name": "Подготовительное отделение МФТИ",
    "url": "https://eng.mipt.ru/info/preparatory_faq/",
    "contacts": [
      {
        "kind": "email",
        "value": "foundationcourse@phystech.edu",
        "label": "Копии полиса"
      }
    ],
    "appointment_required": "unknown"
  },
  "result": {
    "title": "Сведения переданы / локальное действие выполнено",
    "completion_mode": "user_confirmation"
  },
  "warnings": [
    {
      "id": "WARN_UNI_MIPT_POLICY_COPY",
      "severity": "blocking",
      "message": "Локальная инструкция ограничена указанным контекстом; нерешённые детали перечислены отдельно.",
      "unresolved_ids": [
        "UNR_MIPT_POLICY_COPY"
      ]
    }
  ],
  "depends_on": [],
  "effective_period": {},
  "evidence": [
    {
      "source_id": "SRC_MIPT_PREP",
      "locator": "Health Insurance",
      "supports": "Перечисленные локальные действия и реквизиты; федеральный нормативный срок этим источником не устанавливается.",
      "fields": [
        "/instructions",
        "/destination"
      ],
      "checked_on": "2026-09-26",
      "support_level": "partial"
    }
  ],
  "unresolved_ids": [
    "UNR_MIPT_POLICY_COPY"
  ],
  "review": {
    "reviewed_at": "2026-09-26T08:43:03.629789Z",
    "reviewer": "Новое последовательное исследование официальных ресурсов",
    "next_review_on": "2026-10-26"
  }
}
