{
  "schema_version": "1.1.0",
  "id": "UNI_TSU_MEDICAL_COPY",
  "university_id": "UNIV_TSU",
  "kind": "university",
  "version": 1,
  "status": "draft",
  "title": "Передать ТГУ копии самостоятельно полученных медицинских документов",
  "summary": "Передайте копии результатов в УСМП: главный корпус, кабинет 029а.",
  "obligation_scope": "university_internal",
  "applicability": {
    "op": "all",
    "args": [
      {
        "op": "eq",
        "fact": "foreign_person",
        "value": true
      },
      {
        "op": "eq",
        "fact": "tsu_campus",
        "value": "main"
      },
      {
        "op": "eq",
        "fact": "tsu_first_year_level_one",
        "value": true
      }
    ]
  },
  "trigger": {
    "kind": "event",
    "event_type": "tsu_medical_fingerprint_completed",
    "occurrence": "each",
    "where": {
      "op": "always"
    }
  },
  "deadline": {
    "kind": "unknown",
    "unresolved_ids": [
      "UNR_TSU_MEDICAL_COPY"
    ]
  },
  "instructions": [
    "Передайте копии результатов в УСМП: главный корпус, кабинет 029а."
  ],
  "documents": [
    {
      "id": "DOC_UNI_TSU_MEDICAL_COPY_1",
      "title": "Копии результатов медосвидетельствования и дактилоскопии",
      "requirement": "required",
      "form": "unspecified",
      "evidence": [
        {
          "source_id": "SRC_TSU_MEDICAL",
          "locator": "Самостоятельное прохождение",
          "supports": "Локальный комплект из указанного раздела."
        }
      ]
    }
  ],
  "destination": {
    "kind": "physical",
    "name": "УСМП ТГУ",
    "address": "Томск, пр. Ленина, 36, главный корпус, аудитория 029а",
    "contacts": [],
    "appointment_required": "unknown"
  },
  "result": {
    "title": "Сведения переданы / локальное действие выполнено",
    "completion_mode": "user_confirmation"
  },
  "warnings": [
    {
      "id": "WARN_UNI_TSU_MEDICAL_COPY",
      "severity": "blocking",
      "message": "Локальная инструкция ограничена указанным контекстом; нерешённые детали перечислены отдельно.",
      "unresolved_ids": [
        "UNR_TSU_MEDICAL_COPY"
      ]
    }
  ],
  "depends_on": [],
  "effective_period": {},
  "evidence": [
    {
      "source_id": "SRC_TSU_MEDICAL",
      "locator": "Самостоятельное прохождение",
      "supports": "Перечисленные локальные действия и реквизиты; федеральный нормативный срок этим источником не устанавливается.",
      "fields": [
        "/instructions",
        "/destination",
        "/documents"
      ],
      "checked_on": "2026-09-26",
      "support_level": "partial"
    }
  ],
  "unresolved_ids": [
    "UNR_TSU_MEDICAL_COPY"
  ],
  "review": {
    "reviewed_at": "2026-09-26T11:37:54.661491Z",
    "reviewer": "Новое последовательное исследование официальных ресурсов",
    "next_review_on": "2026-10-26"
  }
}
