{
  "schema_version": "1.1.0",
  "id": "UNI_MSU_POLICY_COPY",
  "university_id": "UNIV_MSU",
  "kind": "university",
  "version": 1,
  "status": "draft",
  "title": "Отправить факультету МГУ копию страхового полиса",
  "summary": "Отправьте на почту иностранного отдела факультета копию ДМС либо имеющегося ОМС.",
  "obligation_scope": "university_internal",
  "applicability": {
    "op": "all",
    "args": [
      {
        "op": "eq",
        "fact": "foreign_person",
        "value": true
      },
      {
        "op": "eq",
        "fact": "msu_campus",
        "value": "main"
      },
      {
        "op": "always"
      }
    ]
  },
  "trigger": {
    "kind": "event",
    "event_type": "border_entry",
    "occurrence": "each",
    "where": {
      "op": "always"
    }
  },
  "deadline": {
    "kind": "partial",
    "known": {
      "amount": 7,
      "unit": "calendar_day",
      "direction": "after",
      "anchor_description": "Пересечение границы России",
      "actor": "student",
      "legal_text": "Внутренний срок университета, не федеральная норма."
    },
    "calculation_allowed": false,
    "unresolved_ids": [
      "UNR_MSU_POLICY_COPY"
    ]
  },
  "instructions": [
    "Отправьте на почту иностранного отдела факультета копию ДМС либо имеющегося ОМС."
  ],
  "documents": [
    {
      "id": "DOC_UNI_MSU_POLICY_COPY_1",
      "title": "Копия ДМС или ОМС",
      "requirement": "required",
      "form": "unspecified",
      "evidence": [
        {
          "source_id": "SRC_MSU_HEALTH",
          "locator": "Полис медицинского страхования",
          "supports": "Локальный комплект из указанного раздела."
        }
      ]
    }
  ],
  "destination": {
    "kind": "online",
    "name": "Иностранный отдел своего факультета — официальный каталог МГУ",
    "url": "https://international.msu.ru/faculties",
    "contacts": [],
    "appointment_required": "unknown"
  },
  "result": {
    "title": "Сведения переданы / локальное действие выполнено",
    "completion_mode": "user_confirmation"
  },
  "warnings": [
    {
      "id": "WARN_UNI_MSU_POLICY_COPY",
      "severity": "blocking",
      "message": "Локальная инструкция ограничена указанным контекстом; нерешённые детали перечислены отдельно.",
      "unresolved_ids": [
        "UNR_MSU_POLICY_COPY"
      ]
    }
  ],
  "depends_on": [],
  "effective_period": {},
  "evidence": [
    {
      "source_id": "SRC_MSU_HEALTH",
      "locator": "Полис медицинского страхования",
      "supports": "Перечисленные локальные действия и реквизиты; федеральный нормативный срок этим источником не устанавливается.",
      "fields": [
        "/instructions",
        "/destination",
        "/documents"
      ],
      "checked_on": "2026-09-26",
      "support_level": "partial"
    },
    {
      "source_id": "SRC_MSU_FACULTIES",
      "locator": "Полис медицинского страхования",
      "supports": "Перечисленные локальные действия и реквизиты; федеральный нормативный срок этим источником не устанавливается.",
      "fields": [
        "/instructions",
        "/destination",
        "/documents"
      ],
      "checked_on": "2026-09-26",
      "support_level": "partial"
    },
    {
      "source_id": "SRC_MSU_HEALTH",
      "locator": "Локальное указание срока в источнике карточки",
      "supports": "Опубликованный внутренний срок; неполное исчисление остаётся unresolved.",
      "fields": [
        "/deadline",
        "/reported_deadline_text"
      ],
      "checked_on": "2026-09-26",
      "support_level": "partial"
    }
  ],
  "unresolved_ids": [
    "UNR_MSU_POLICY_COPY"
  ],
  "review": {
    "reviewed_at": "2026-09-26T08:36:33.319008Z",
    "reviewer": "Новое последовательное исследование официальных ресурсов",
    "next_review_on": "2026-10-26"
  },
  "reported_deadline_text": "В течение 7 календарных дней после пересечения границы"
}
