{
  "schema_version": "1.1.0",
  "id": "UNI_SPBU_DORM_ASSIGNMENT",
  "university_id": "UNIV_SPBU",
  "kind": "university",
  "version": 1,
  "status": "draft",
  "title": "Проверить распределение в общежитие СПбГУ",
  "summary": "Проверьте назначенное общежитие в опубликованном списке. Для несовершеннолетнего подготовьте согласие родителей.",
  "obligation_scope": "university_internal",
  "applicability": {
    "op": "all",
    "args": [
      {
        "op": "eq",
        "fact": "foreign_person",
        "value": true
      },
      {
        "op": "eq",
        "fact": "spbu_campus",
        "value": "main"
      },
      {
        "op": "eq",
        "fact": "spbu_own_dormitory",
        "value": true
      }
    ]
  },
  "trigger": {
    "kind": "event",
    "event_type": "spbu_dorm_assignment_ready",
    "occurrence": "each",
    "where": {
      "op": "always"
    }
  },
  "deadline": {
    "kind": "unknown",
    "unresolved_ids": [
      "UNR_SPBU_DORM_ASSIGNMENT"
    ]
  },
  "instructions": [
    "Проверьте назначенное общежитие в опубликованном списке. Для несовершеннолетнего подготовьте согласие родителей."
  ],
  "documents": [],
  "destination": {
    "kind": "online",
    "name": "Студгородок СПбГУ",
    "url": "https://guide.spbu.ru/dormitory",
    "contacts": [
      {
        "kind": "email",
        "value": "911@spbu.ru",
        "label": "Студгородок"
      }
    ],
    "appointment_required": "unknown"
  },
  "result": {
    "title": "Сведения переданы / локальное действие выполнено",
    "completion_mode": "user_confirmation"
  },
  "warnings": [
    {
      "id": "WARN_UNI_SPBU_DORM_ASSIGNMENT",
      "severity": "blocking",
      "message": "Локальная инструкция ограничена указанным контекстом; нерешённые детали перечислены отдельно.",
      "unresolved_ids": [
        "UNR_SPBU_DORM_ASSIGNMENT"
      ]
    }
  ],
  "depends_on": [],
  "effective_period": {},
  "evidence": [
    {
      "source_id": "SRC_SPBU_DORM",
      "locator": "Заселение и проживание",
      "supports": "Перечисленные локальные действия и реквизиты; федеральный нормативный срок этим источником не устанавливается.",
      "fields": [
        "/instructions",
        "/destination"
      ],
      "checked_on": "2026-09-26",
      "support_level": "partial"
    }
  ],
  "unresolved_ids": [
    "UNR_SPBU_DORM_ASSIGNMENT"
  ],
  "review": {
    "reviewed_at": "2026-09-26T11:34:43.776826Z",
    "reviewer": "Новое последовательное исследование официальных ресурсов",
    "next_review_on": "2026-10-26"
  }
}
